
<?xml version="1.0" ?>
<!DOCTYPE PISI SYSTEM "www.limelinux.com/standard/pisi-spec.dtd">
<PISI>
    <Source>
        <Name>partitionmanager</Name>
        <Homepage>http://www.kde.org</Homepage>
        <Packager>
            <Name>Lime GNU/LINUX Community</Name>
            <Email>admin@limelinux.com</Email>
        </Packager>
        <License>LGPLv2</License>
        <IsA>app:gui</IsA>
        <Summary>KDE Partition Manager is a utility program to help you manage the disk devices, partitions and file systems on your computer</Summary>
        <Description>It allows you to easily create, copy, move, delete, resize without losing data, backup and restore partitions..</Description>
        <Archive sha1sum="152eddcb7be7b9f6271019fdfdc18ada9547628f" type="tarxz">mirrors://kde/stable/partitionmanager/3.0.0/src/partitionmanager-3.0.0.tar.xz</Archive>
        <BuildDependencies>
            <Dependency>qt5</Dependency>
            <Dependency>libgcc</Dependency>
            <Dependency>util-linux</Dependency>
            <Dependency>kio</Dependency>
            <Dependency>ki18n</Dependency>
            <Dependency>kconfig</Dependency>
            <Dependency>kxmlgui</Dependency>
            <Dependency>kservice</Dependency>
            <Dependency>kcoreaddons</Dependency>
            <Dependency>kiconthemes</Dependency>
            <Dependency>kjobwidgets</Dependency>
            <Dependency>kconfigwidgets</Dependency>
            <Dependency>kwidgetsaddons</Dependency>
            <Dependency>kpmcore</Dependency>
            <Dependency>kcrash</Dependency>
        </BuildDependencies>
    </Source>

    <Package>
        <Name>partitionmanager</Name>
        <RuntimeDependencies>
            <Dependency>qt5</Dependency>
            <Dependency>libgcc</Dependency>
            <Dependency>util-linux</Dependency>
            <Dependency>kio</Dependency>
            <Dependency>ki18n</Dependency>
            <Dependency>kconfig</Dependency>
            <Dependency>kxmlgui</Dependency>
            <Dependency>kservice</Dependency>
            <Dependency>kcoreaddons</Dependency>
            <Dependency>kiconthemes</Dependency>
            <Dependency>kjobwidgets</Dependency>
            <Dependency>kconfigwidgets</Dependency>
            <Dependency>kwidgetsaddons</Dependency>
            <Dependency>kpmcore</Dependency>
            <Dependency>kcrash</Dependency>
        </RuntimeDependencies>
        <Files>
            <Path fileType="executable">/usr/bin</Path>
            <Path fileType="data">/usr/share</Path>
            <Path fileType="library">/usr/lib</Path>
            <Path fileType="library">/usr/lib/qt5</Path>
            <Path fileType="doc">/usr/share/doc</Path>
        </Files>
    </Package>

    <History>
        <Update release="1">
            <Date>2016-12-20</Date>
            <Version>3.0.0</Version>
            <Comment>First release</Comment>
            <Name>Lime GNU/LINUX Community</Name>
            <Email>admin@limelinux.com</Email>
        </Update>
    </History>
</PISI>
