
<?xml version="1.0" ?>
<!DOCTYPE PISI SYSTEM "www.limelinux.com/standard/pisi-spec.dtd">
<PISI>
    <Source>
        <Name>libxml2</Name>
        <Homepage>http://www.xmlsoft.org/</Homepage>
        <Packager>
            <Name>Lime GNU/LINUX Community</Name>
            <Email>admin@limelinux.com</Email>
        </Packager>
        <License>MIT</License>
        <IsA>library</IsA>
        <Summary>Version 2 of the library to manipulate XML files</Summary>
        <Description>Libxml2 is the XML C parser and toolkit developed for the Gnome project (but usable outside of the Gnome platform).</Description>
        <Archive sha1sum="958ae70baf186263a4bd801a81dd5d682aedd1db" type="targz">ftp://xmlsoft.org/libxml2/libxml2-2.9.4.tar.gz</Archive>
        <BuildDependencies>
            <Dependency>xz</Dependency>
            <Dependency>zlib</Dependency>
            <Dependency>readline</Dependency>
        </BuildDependencies>
    </Source>


    <Package>
        <Name>libxml2</Name>
        <RuntimeDependencies>
            <Dependency>xz</Dependency>
            <Dependency>zlib</Dependency>
            <Dependency>readline</Dependency>
        </RuntimeDependencies>
        <Files>
            <Path fileType="executable">/usr/bin</Path>
            <Path fileType="library">/usr/lib</Path>
            <Path fileType="data">/usr/share</Path>
            <Path fileType="header">/usr/include</Path>
        </Files>
    </Package>


    <History>
        <Update release="1">
            <Date>2016-12-21</Date>
            <Version>2.9.4</Version>
            <Comment>First Release</Comment>
            <Name>Lime GNU/LINUX Community</Name>
            <Email>admin@limelinux.com</Email>
        </Update>
    </History>
</PISI>
