
<?xml version="1.0" ?>
<!DOCTYPE PISI SYSTEM "www.limelinux.com/standard/pisi-spec.dtd">
<PISI>
    <Source>
        <Name>python-scapy</Name>
        <Homepage>http://www.secdev.org/projects/scapy/files</Homepage>
        <Packager>
            <Name>Lime GNU/LINUX Community</Name>
            <Email>admin@limelinux.com</Email>
        </Packager>
        <License>GPLv2</License>
        <IsA>app:console</IsA>
        <IsA>library</IsA>
        <Summary>Powerful interactive packet manipulation program</Summary>
        <Description>Powerful interactive packet manipulation program</Description>
        <Archive sha1sum="ae0a9947a08a01a84abde9db12fed074ac888e47" type="targz">http://www.secdev.org/projects/scapy/files/scapy-2.2.0.tar.gz</Archive>
    </Source>

    <Package>
        <Name>python-scapy</Name>
        <RuntimeDependencies>
            <Dependency>python-pycrypto</Dependency>
            <Dependency>python-gnuplot-py</Dependency>
            <Dependency>gnuplot</Dependency>
            <Dependency>graphviz</Dependency>
        </RuntimeDependencies>
        <Files>
            <Path fileType="executable">/usr/bin</Path>
            <Path fileType="library">/usr/lib</Path>
            <Path fileType="man">/usr/share/man</Path>
            <Path fileType="doc">/usr/share/doc</Path>
        </Files>
    </Package>

    <History>
        <Update release="2">
            <Date>2016-12-21</Date>
            <Version>2.2.0</Version>
            <Comment>First Release</Comment>
            <Name>Lime GNU/LINUX Community</Name>
            <Email>admin@limelinux.com</Email>
        </Update>
    </History>
</PISI>
