<?xml version="1.0" ?>
<!DOCTYPE PISI SYSTEM "http://www.limelinux.com/standard/pisi-spec.dtd">
<PISI>
    <Source>
        <Name>kitemviews</Name>
        <Homepage>http://www.kde.org</Homepage>
        <Packager>
            <Name>Lime GNU/LINUX Community</Name>
            <Email>admin@limelinux.com</Email>
        </Packager>
        <License>LGPLv2</License>
        <IsA>library</IsA>
        <IsA>app:console</IsA>
        <Summary>Set of item models extending the Qt model-view framework</Summary>
        <Description>KItemViews includes a set of views, which can be used with item models. It includes views for categorizing lists and to add search filters to flat and hierarchical lists.</Description>
        <Archive sha1sum="2bea57d87dcaf06d6d23f154df9e690e93cde95d" type="tarxz">mirrors://kde/stable/frameworks/5.33/kitemviews-5.33.0.tar.xz</Archive>
        <BuildDependencies>
            <Dependency>qt5</Dependency>
            <Dependency>extra-cmake-modules</Dependency>
        </BuildDependencies>
    </Source>

    <Package>
        <Name>kitemviews</Name>
        <RuntimeDependencies>
            <Dependency>qt5</Dependency>
            <Dependency>libgcc</Dependency>
        </RuntimeDependencies>
        <Files>
            <Path fileType="data">/usr/share</Path>
            <Path fileType="localedata">/usr/share/locale</Path>
            <Path fileType="library">/usr/lib/qt5</Path>
            <Path fileType="library">/usr/lib</Path>
            <Path fileType="doc">/usr/share/doc</Path>
            <Path fileType="header">/usr/include</Path>
            <Path fileType="data">/usr/lib/cmake</Path>
            <Path fileType="config">/usr/lib/pkgconfig</Path>
        </Files>
    </Package>

    <History>
        <Update release="2">
            <Date>2017-05-05</Date>
            <Version>5.33.0</Version>
            <Comment>Version bump.</Comment>
            <Name>mahlas temir</Name>
            <Email>mahlastemir@gmail.com</Email>
        </Update>
    </History>
</PISI>
