
<?xml version="1.0" ?>
<!DOCTYPE PISI SYSTEM "www.limelinux.com/standard/pisi-spec.dtd">
<PISI>
    <Source>
        <Name>mtools</Name>
        <Homepage>http://mtools.linux.lu/</Homepage>
        <Packager>
            <Name>Lime GNU/LINUX Community</Name>
            <Email>admin@limelinux.com</Email>
        </Packager>
        <License>GPLv2</License>
        <IsA>app:console</IsA>
        <Summary>Utilities to access MS-DOS disks without mounting them</Summary>
        <Description>Mtools are utilities to access MS-DOS disks without mounting them.</Description>
        <Archive sha1sum="d703db71a409837a37db10a09ef63a35183f7565" type="targz">mirrors://gnu/mtools/mtools-4.0.18.tar.gz</Archive>
    </Source>

    <Package>
        <Name>mtools</Name>
        <Files>
            <Path fileType="executable">/usr/bin</Path>
            <Path fileType="config">/etc</Path>
            <Path fileType="doc">/usr/share/doc</Path>
            <Path fileType="info">/usr/share/info</Path>
            <Path fileType="man">/usr/share/man</Path>
        </Files>
    </Package>

    <History>
        <Update release="1">
            <Date>2016-12-21</Date>
            <Version>4.0.18</Version>
            <Comment>First Release</Comment>
            <Name>Lime GNU/LINUX Community</Name>
            <Email>admin@limelinux.com</Email>
        </Update>
    </History>
</PISI>
