
<?xml version="1.0" ?>
<!DOCTYPE PISI SYSTEM "www.limelinux.com/standard/pisi-spec.dtd">
<PISI>
    <Source>
        <Name>mozjs38</Name>
        <Homepage>http://www.mozilla.org/js/spidermonkey/</Homepage>
        <Packager>
            <Name>Lime GNU/LINUX Community</Name>
            <Email>admin@limelinux.com</Email>
        </Packager>
        <License>NPL-1.1</License>
        <IsA>library</IsA>
        <Summary>Stand-alone JavaScript C Library</Summary>
        <Description>Spidermonkey is Mozilla's C implementation of JavaScript.</Description>
        <Archive type="tarbz2" sha1sum="14367a7102ef2c54e0715bf16340fb4de9cb75ed">https://ftp.mozilla.org/pub/firefox/releases/38.8.0esr/source/firefox-38.8.0esr.source.tar.bz2</Archive>
        <BuildDependencies>
            <Dependency>zlib</Dependency>
            <Dependency>nspr</Dependency>
            <Dependency>readline</Dependency>
            <Dependency>libffi</Dependency>
        </BuildDependencies>
        <Patches>
            <!--Patch level="1">mozjs38-1269317.patch</Patch>
            <Patch level="1">mozjs38-add-bracket.patch</Patch>
            <Patch level="1">mozjs38-copy-headers.patch</Patch>
            <Patch level="1">mozjs38-fix-tracelogger.patch</Patch>
            <Patch level="1">mozjs38-install-name.patch</Patch>
            <Patch level="1">mozjs38-pkg-config-version.patch</Patch>
            <Patch level="1">mozjs38-shell-version.patch</Patch-->
        </Patches>
    </Source>

    <Package>
        <Name>mozjs38</Name>
        <RuntimeDependencies>
            <Dependency>nspr</Dependency>
            <Dependency>zlib</Dependency>
            <Dependency>readline</Dependency>
        </RuntimeDependencies>
        <Files>
            <Path fileType="executable">/usr/bin</Path>
            <Path fileType="library">/usr/lib</Path>
            <Path fileType="doc">/usr/share/doc</Path>
            <Path fileType="header">/usr/include</Path>
        </Files>
    </Package>


    <History>
        <Update release="1">
            <Date>2017-12-21</Date>
            <Version>38.2.8</Version>
            <Comment>First Release</Comment>
            <Name>Lime GNU/LINUX Community</Name>
            <Email>admin@limelinux.com</Email>
        </Update>
    </History>
</PISI>
