<?xml version="1.0" ?> 
<!DOCTYPE PISI SYSTEM "https://raw.githubusercontent.com/LimeLinux/Packages/master/pisi-spec.dtd">
<PISI>
    <Source>
        <Name>kproperty</Name>
        <Homepage>http://www.kexi-project.org/</Homepage>
        <Packager>
            <Name>lime Gnu/Linux Community</Name>
            <Email>admin@limelinux.com</Email>
        </Packager>
        <License>GPLv2+</License>
        <IsA>app:console</IsA>
        <Summary>A property editing framework with editor widget similar to what is known from Qt Designer</Summary>
        <Description>A property editing framework with editor widget similar to what is known from Qt Designer</Description>
        <Archive type="tarxz" sha1sum="9eb6b83c0bb5b62d9c219415bc05a5677fbc3ab3">http://download.kde.org/stable/kproperty/src/kproperty-3.0.0.tar.xz</Archive>
        <BuildDependencies>
            <Dependency>extra-cmake-modules</Dependency>
            <Dependency>qt5</Dependency>
            <Dependency>kconfig</Dependency>
            <Dependency>kcoreaddons</Dependency>
            <Dependency>kwidgetsaddons</Dependency>
            <Dependency>kguiaddons</Dependency>
            <Dependency>ki18n</Dependency>
        </BuildDependencies>
    </Source>

    <Package>
        <Name>kproperty</Name>
        <Summary>A property editing framework with editor widget similar to what is known from Qt Designer</Summary>
        <RuntimeDependencies>
            <Dependency>libgcc</Dependency>
            <Dependency>kconfig</Dependency>
            <Dependency>qt5</Dependency>
            <Dependency>kguiaddons</Dependency>
            <Dependency>kwidgetsaddons</Dependency>
        </RuntimeDependencies>
        <Files>
            <Path fileType="library">/usr/lib</Path>
            <Path fileType="data">/usr/share</Path>
            <Path fileType="header">/usr/include</Path>
        </Files>
    </Package>

    <History>
        <Update release="1">
            <Date>2017-01-04</Date>
            <Version>3.0.0</Version>
            <Comment>First release</Comment>
            <Name>lime Gnu/Linux Community</Name>
            <Email>admin@limelinux.com</Email>
        </Update>
    </History>
</PISI>