
<?xml version="1.0" ?>
<!DOCTYPE PISI SYSTEM "http://www.limelinux.com/standard/pisi-spec.dtd">
<PISI>
    <Source>
        <Name>zenity</Name>
        <Homepage>https://live.gnome.org/Zenity</Homepage>
        <Packager>
            <Name>Lime GNU/LINUX Community</Name>
            <Email>admin@limelinux.com</Email>
        </Packager>
        <License>LGPLv2</License>
        <IsA>app:gui</IsA>
        <Summary>A rewrite of gdialog</Summary>
        <Description>Zenity is the GNOME port of dialog which allows you to display dialog boxes from the commandline and shell scripts.</Description>
        <Archive sha1sum="52a167e8d0b10d351c71dbb3483b3cf11305c155" type="tarxz">https://git.gnome.org/browse/zenity/snapshot/zenity-3.24.0.tar.xz</Archive>
        <BuildDependencies>
            <Dependency>gtk3</Dependency>
            <Dependency>pango</Dependency>
            <Dependency>gnome-common</Dependency>
            <Dependency>gnome-doc-utils</Dependency>
            <Dependency>libnotify</Dependency>
            <Dependency>gdk-pixbuf</Dependency>
	        <Dependency>yelp-tools</Dependency>
	        <Dependency>yelp-xsl</Dependency>
        </BuildDependencies>
    </Source>

    <Package>
        <Name>zenity</Name>
        <RuntimeDependencies>
            <Dependency>gtk3</Dependency>
            <Dependency>pango</Dependency>
            <Dependency>libnotify</Dependency>
            <Dependency>gdk-pixbuf</Dependency>
	        <Dependency>yelp-tools</Dependency>
	        <Dependency>yelp-xsl</Dependency>
        </RuntimeDependencies>
        <Files>
            <Path fileType="data">/usr/share/</Path>
            <Path fileType="library">/usr/lib</Path>
            <Path fileType="doc">/usr/share/doc</Path>
            <Path fileType="executable">/usr/bin</Path>
            <Path fileType="config">/etc/xdg/menus</Path>
            <Path fileType="localedata">/usr/share/locale</Path>
        </Files>
    </Package>

    <History>
        <Update release="1">
            <Date>2017-03-01</Date>
            <Version>3.24.0</Version>
            <Comment>First Release</Comment>
            <Name>Lime GNU/LINUX Community</Name>
            <Email>admin@limelinux.com</Email>
        </Update>
    </History>
</PISI>
