
<?xml version="1.0" ?>
<!DOCTYPE PISI SYSTEM "www.limelinux.com/standard/pisi-spec.dtd">
<PISI>
    <Source>
        <Name>libupnp</Name>
        <Homepage>http://pupnp.sourceforge.net/</Homepage>
        <Packager>
            <Name>Lime GNU/LINUX Community</Name>
            <Email>admin@limelinux.com</Email>
        </Packager>
        <License>BSD</License>
        <IsA>library</IsA>
        <Summary>Portable UPnP library</Summary>
        <Description>The Universal Plug and Play (UPnP) SDK for Linux provides support for building UPnP-compliant control points, devices, and bridges on Linux.</Description>
        <Archive sha1sum="7983268c61126a4a9ab8757aa059f7f4c4cbc62d" type="tarbz2">https://sources.voidlinux.eu/libupnp-1.6.24/libupnp-1.6.24.tar.bz2</Archive>
        <BuildDependencies>
        </BuildDependencies>
        <Patches>
            <Patch level="1">pthread-flag.patch</Patch>
        </Patches>
    </Source>

    <Package>
        <Name>libupnp</Name>
        <Files>
            <Path fileType="library">/usr/lib</Path>
            <Path fileType="doc">/usr/share/doc</Path>
	    <Path fileType="header">/usr/include</Path>
        </Files>
    </Package>

    <History>
        <Update release="2">
            <Date>2018-02-28</Date>
            <Version>1.6.24</Version>
            <Comment>First Release</Comment>
            <Name>Lime GNU/LINUX Community</Name>
            <Email>admin@limelinux.com</Email>
        </Update>
    </History>
</PISI>
