
<?xml version="1.0" ?>
<!DOCTYPE PISI SYSTEM "www.limelinux.com/standard/pisi-spec.dtd">
<PISI>
    <Source>
        <Name>powertop</Name>
        <Homepage>http://www.lesswatts.org/projects/powertop/</Homepage>
        <Packager>
            <Name>Lime GNU/LINUX Community</Name>
            <Email>admin@limelinux.com</Email>
        </Packager>
        <License>GPLv2</License>
        <IsA>app:console</IsA>
        <Summary>Power consumption monitor</Summary>
        <Description>PowerTOP is a Linux tool that finds the software component(s) that make your computer use more power than necessary while it is idle.</Description>
        <Archive sha1sum="60da464a0c5d39c64b5d4a0e854bc6c480f8927a" type="targz">https://01.org/sites/default/files/downloads/powertop/powertop-2.8.tar.gz</Archive>
        <BuildDependencies>
            <Dependency>libnl</Dependency>
            <Dependency>ncurses</Dependency>
            <Dependency>pciutils</Dependency>
        </BuildDependencies>
    </Source>

    <Package>
        <Name>powertop</Name>
        <RuntimeDependencies>
            <Dependency>libnl</Dependency>
            <Dependency>ncurses</Dependency>
            <Dependency>libgcc</Dependency>
            <Dependency>pciutils</Dependency>
        </RuntimeDependencies>
        <Files>
            <Path fileType="man">/usr/share/man</Path>
            <Path fileType="doc">/usr/share/doc</Path>
            <Path fileType="executable">/usr/bin</Path>
            <Path fileType="executable">/usr/sbin</Path>
            <Path fileType="data">/var/cache/powertop</Path>
            <Path fileType="localedata">/usr/share/locale</Path>
        </Files>
    </Package>

    <History>
	    <Update release="2">
            <Date>2016-07-02</Date>
            <Version>2.8</Version>
            <Comment>First release</Comment>
            <Name>Lime GNU/LINUX Community</Name>
            <Email>admin@limelinux.com</Email>
        </Update>
        <Update release="1">
            <Date>2016-07-02</Date>
            <Version>2.8</Version>
            <Comment>First release</Comment>
            <Name>Lime GNU/LINUX Community</Name>
            <Email>admin@limelinux.com</Email>
        </Update>
    </History>
</PISI>
