
<?xml version="1.0" ?>
<!DOCTYPE PISI SYSTEM "www.limelinux.com/standard/pisi-spec.dtd">
<PISI>
    <Source>
        <Name>gst-plugins-good-next</Name>
        <Homepage>http://gstreamer.net/</Homepage>
        <Packager>
            <Name>Lime GNU/LINUX Community</Name>
            <Email>admin@limelinux.com</Email>
        </Packager>
        <License>GPLv2</License>
        <IsA>library</IsA>
        <Summary>A set of good-quality plugins for GStreamer</Summary>
        <Description>gst-plugins-good contains a set of mature plugins and elements for GStreamer.</Description>
        <Archive sha1sum="201db5fe223325feaf79a256588d526df0a7d57f" type="tarxz">https://gstreamer.freedesktop.org/src/gst-plugins-good/gst-plugins-good-1.8.1.tar.xz</Archive>
        <BuildDependencies>
            <Dependency>gst-plugins-base-next</Dependency>
            <Dependency>pulseaudio</Dependency>
            <Dependency>gstreamer-next</Dependency>
            <Dependency>libjpeg-turbo</Dependency>
            <Dependency>gdk-pixbuf</Dependency>
            <Dependency>libraw1394</Dependency>
            <Dependency>libXdamage</Dependency>
            <Dependency>libXfixes</Dependency>
            <Dependency>libsoup</Dependency>
            <Dependency>libXext</Dependency>
            <Dependency>libv4l</Dependency>
            <Dependency>libXv</Dependency>
            <Dependency>cairo</Dependency>
            <Dependency>aalib</Dependency>
            <Dependency>speex</Dependency>
            <Dependency>gtk2</Dependency>
            <Dependency>flac</Dependency>
            <Dependency>orc</Dependency>
        </BuildDependencies>
    </Source>

    <Package>
        <Name>gst-plugins-good-next</Name>
        <RuntimeDependencies>
            <Dependency>orc</Dependency>
            <Dependency>flac</Dependency>
            <Dependency>zlib</Dependency>
            <Dependency>speex</Dependency>
            <Dependency>libX11</Dependency>
            <Dependency>libpng</Dependency>
            <Dependency>cairo</Dependency>
            <Dependency>glib2</Dependency>
            <Dependency>aalib</Dependency>
            <Dependency>bzip2</Dependency>
            <Dependency>libv4l</Dependency>
            <Dependency>libXext</Dependency>
            <Dependency>libsoup</Dependency>
            <Dependency>libXfixes</Dependency>
            <Dependency>gdk-pixbuf</Dependency>
            <Dependency>libXdamage</Dependency>
            <Dependency>libjpeg-turbo</Dependency>
            <Dependency>gstreamer-next</Dependency>
            <Dependency>pulseaudio</Dependency>
            <Dependency>gst-plugins-base-next</Dependency>
        </RuntimeDependencies>
        <Files>
            <Path fileType="config">/etc/gconf</Path>
            <Path fileType="executable">/usr/bin</Path>
            <Path fileType="library">/usr/lib</Path>
            <Path fileType="data">/usr/share/gstreamer-1.0/presets</Path>
            <Path fileType="doc">/usr/share/doc</Path>
            <Path fileType="doc">/usr/share/gtk-doc</Path>
            <Path fileType="man">/usr/share/man</Path>
            <Path fileType="localedata">/usr/share/locale</Path>
        </Files>
    </Package>

    <History>
        <Update release="2">
            <Date>2017-06-10</Date>
            <Version>1.8.1</Version>
            <Comment>First release</Comment>
            <Name>Lime GNU/LINUX Community</Name>
            <Email>admin@limelinux.com</Email>
        </Update>
        <Update release="1">
            <Date>2016-06-10</Date>
            <Version>1.8.1</Version>
            <Comment>First release</Comment>
            <Name>Lime GNU/LINUX Community</Name>
            <Email>admin@limelinux.com</Email>
        </Update>
    </History>
</PISI>
