<?xml version="1.0" ?>
<!DOCTYPE PISI SYSTEM "https://raw.githubusercontent.com/LimeLinux/Packages/master/pisi-spec.dtd">
<PISI>
    <Source>
        <Name>kmix</Name>
        <Homepage>http://kde.org/applications/multimedia/kmix/</Homepage>
        <Packager>
            <Name>lime Gnu/Linux Community</Name>
            <Email>admin@limelinux.com</Email>
        </Packager>
        <License>GPLv2</License>
        <Icon>kmix</Icon>
        <IsA>app:gui</IsA>
        <PartOf>desktop.kde.multimedia</PartOf>
        <Summary>KMix: KDE Digital Mixer</Summary>
        <Description>KMix: KDE Digital Mixer</Description>
        <Archive sha1sum="d79c7c4b00205f0f06602f494ae5a0f16337b474" type="tarxz">mirrors://kde/stable/applications/16.12.3/src/kmix-16.12.3.tar.xz</Archive>
        <BuildDependencies>
            <Dependency versionFrom="5.7.1">qt5</Dependency>
            <Dependency>extra-cmake-modules</Dependency>
            <Dependency>kdoctools</Dependency>
            <Dependency>kdelibs4-support</Dependency>
            <Dependency>ki18n</Dependency>
            <Dependency>kcmutils</Dependency>
            <Dependency>kemoticons</Dependency>
            <Dependency>kitemmodels</Dependency>
            <Dependency>kinit</Dependency>
            <Dependency>kunitconversion</Dependency>
            <Dependency>kdesignerplugin</Dependency>
            <Dependency>libcanberra</Dependency>
            <Dependency>glib2</Dependency>
            <Dependency>alsa-lib</Dependency>
            <Dependency>kglobalaccel</Dependency>
            <Dependency>plasma-framework</Dependency>
            <Dependency>extra-cmake-modules</Dependency>
        </BuildDependencies>
    </Source>

    <Package>
        <Name>kmix</Name>
        <RuntimeDependencies>
            <Dependency versionFrom="5.7.1">qt5</Dependency>
            <Dependency>alsa-lib</Dependency>
            <Dependency>libcanberra</Dependency>
            <Dependency>pulseaudio</Dependency>
            <Dependency>kdelibs4-support</Dependency>
            <Dependency>ki18n</Dependency>
            <Dependency>kconfig</Dependency>
            <Dependency>kxmlgui</Dependency>
            <Dependency>kcompletion</Dependency>
            <Dependency>kcoreaddons</Dependency>
            <Dependency>kdbusaddons</Dependency>
            <Dependency>kiconthemes</Dependency>
            <Dependency>kglobalaccel</Dependency>
            <Dependency>kwindowsystem</Dependency>
            <Dependency>kconfigwidgets</Dependency>
            <Dependency>knotifications</Dependency>
            <Dependency>kwidgetsaddons</Dependency>
            <Dependency>libgcc</Dependency>
            <Dependency>plasma-framework</Dependency>
        </RuntimeDependencies>
        <Files>
            <Path fileType="config">/etc</Path>
            <Path fileType="data">/usr/share</Path>
            <Path fileType="library">/usr/lib</Path>
            <Path fileType="doc">/usr/share/doc</Path>
            <Path fileType="header">/usr/include</Path>
            <Path fileType="executable">/usr/bin</Path>
        </Files>
    </Package>

    <History>
        <Update release="1">
            <Date>2017-03-17</Date>
            <Version>16.12.3</Version>
            <Comment>First release</Comment>
            <Name>mahlas temir</Name>
            <Email>mahlastemir@gmail.com</Email>
        </Update>
    </History>
</PISI>