<?xml version="1.0" ?>
<!DOCTYPE PISI SYSTEM "http://www.limelinux.com/standard/pisi-spec.dtd">
<PISI>
    <Source>
        <Name>notify-python</Name>
        <Homepage>http://www.galago-project.com</Homepage>
        <Packager>
            <Name>LimeLinux Community</Name>
            <Email>admins@pisilinux.org</Email>
        </Packager>
        <License>GPLv2</License>
        <IsA>app:console</IsA>
        <Summary>Python bindings for libnotify</Summary>
        <Description>notify-python are Python bindings for the Galago project's notification library libnotify.</Description>
        <Archive sha1sum="0e2b8525b1aabf0924c5efb53ced6aa429240ed0" type="targz">http://galago-project.org/files/releases/source/notify-python/notify-python-0.1.1.tar.gz</Archive>
        <BuildDependencies>
            <Dependency>libnotify</Dependency>
            <Dependency>python</Dependency>
            <Dependency>python-gtk</Dependency>
            <Dependency>gtk2</Dependency>
        </BuildDependencies>
        <Patches>
            <Patch level="1">link-with-python.patch</Patch>
            <Patch level="1">notify-python-0.1.1-fix-GTK-symbols.patch</Patch>
            <Patch level="1">libnotify0.7.patch</Patch>
        </Patches>
    </Source>

    <Package>
        <Name>notify-python</Name>
        <RuntimeDependencies>
            <Dependency>atk</Dependency>
            <Dependency>gtk2</Dependency>
            <Dependency>cairo</Dependency>
            <Dependency>glib2</Dependency>
            <Dependency>pango</Dependency>
            <Dependency>python</Dependency>
            <Dependency>freetype</Dependency>
            <Dependency>libnotify</Dependency>
            <Dependency>fontconfig</Dependency>
            <Dependency>gdk-pixbuf</Dependency>
        </RuntimeDependencies>
        <Files>
            <Path fileType="library">/usr/lib</Path>
            <Path fileType="data">/usr/lib/pkgconfig</Path>
            <Path fileType="data">/usr/share/pygtk/2.0/defs</Path>
        </Files>
    </Package>

    <History>
        <Update release="2">
            <Date>2017-01-09</Date>
            <Version>0.1.1</Version>
            <Comment>First release</Comment>
            <Name>Erg√ºn Salman</Name>
            <Email>poyraz76@limelinux.com</Email>
        </Update>
    </History>
</PISI>
