
<?xml version="1.0" ?>
<!DOCTYPE PISI SYSTEM "www.limelinux.com/standard/pisi-spec.dtd">
<PISI>
    <Source>
        <Name>lsof</Name>
        <Homepage>http://people.freebsd.org/~abe/</Homepage>
        <Packager>
            <Name>Lime GNU/LINUX Community</Name>
            <Email>admin@limelinux.com</Email>
        </Packager>
        <License>GPLv2</License>
        <IsA>app:console</IsA>
        <Summary>Lists open files for running Unix processes</Summary>
        <Description>lsof is a Unix-specific diagnostic tool. Its name stands for LiSt Open Files, and it does just that. It lists information about any files that are open by processes currently running on the system. It can also list communications open by each process.</Description>
        <Archive sha1sum="9e260fb314272273965050064e9bcd636eb63388" type="tar">https://sourceforge.net/projects/limeteam/files/source-limelinux/lsof_4.89_src.tar</Archive>
    </Source>

    <Package>
        <Name>lsof</Name>
        <Files>
            <Path fileType="executable">/usr/sbin</Path>
            <Path fileType="doc">/usr/share/doc</Path>
            <Path fileType="data">/usr/share/lsof</Path>
            <Path fileType="man">/usr/share/man</Path>
        </Files>
    </Package>

    <History>
        <Update release="2">
            <Date>2018-02-28</Date>
            <Version>4.89</Version>
            <Comment>First Release</Comment>
            <Name>Lime GNU/LINUX Community</Name>
            <Email>admin@limelinux.com</Email>
        </Update>
    </History>
</PISI>
