
<?xml version="1.0" ?>
<!DOCTYPE PISI SYSTEM "www.limelinux.com/standard/pisi-spec.dtd">
<PISI>
    <Source>
        <Name>gperftools</Name>
        <Homepage>https://github.com/gperftools/gperftools</Homepage>
        <Packager>
            <Name>Lime GNU/LINUX Community</Name>
            <Email>admin@limelinux.com</Email>
        </Packager>
        <License>BSD</License>
        <IsA>library</IsA>
        <IsA>app:console</IsA>
        <Summary>Google Performance Tools</Summary>
        <Description>Perf Tools is a collection of a high-performance multi-threaded malloc() implementation, plus some pretty nifty performance analysis tools.</Description>
        <Archive sha1sum="b7b0a24cbe052e0c4b69d43d7ecb5d8fca1dfa1c" type="targz">https://github.com/gperftools/gperftools/archive/gperftools-2.5.tar.gz</Archive>
    </Source>

    <Package>
        <Name>gperftools</Name>
        <RuntimeDependencies>
            <Dependency>libunwind</Dependency>
        </RuntimeDependencies>
        <Files>
            <Path fileType="executable">/usr/bin</Path>
            <Path fileType="library">/usr/lib</Path>
            <Path fileType="doc">/usr/share/doc/gperftools/COPYING</Path>
            <Path fileType="man">/usr/share/man</Path>
            <Path fileType="header">/usr/include</Path>
            <Path fileType="doc">/usr/share/doc/gperftools</Path>
        </Files>
    </Package>

    <History>
        <Update release="1">
            <Date>2016-12-21</Date>
            <Version>2.5</Version>
            <Comment>First Release</Comment>
            <Name>Lime GNU/LINUX Community</Name>
            <Email>admin@limelinux.com</Email>
        </Update>
    </History>
</PISI>
