
<?xml version="1.0" ?>
<!DOCTYPE PISI SYSTEM "www.limelinux.com/standard/pisi-spec.dtd">
<PISI>
    <Source>
        <Name>libbluray</Name>
        <Homepage>http://www.videolan.org/developers/libbluray.html</Homepage>
        <Packager>
            <Name>Lime GNU/LINUX Community</Name>
            <Email>admin@limelinux.com</Email>
        </Packager>
        <License>LGPLv2</License>
        <IsA>library</IsA>
        <Summary>Library to access Blu-Ray disks for video playback</Summary>
        <Description>Libbluray package is aiming to provide a full portable free open source bluray library, which can be plugged into popular media players to allow full bluray navigation and playback on Linux. It will eventually be compatible with all current titles, and will be easily portable and embeddable in standard players such as mplayer and vlc.</Description>
        <Archive sha1sum="34eedb13e220eb88a5f58660bdb4e727e775fc83" type="tarbz2">ftp://ftp.videolan.org/pub/videolan/libbluray/0.9.2/libbluray-0.9.2.tar.bz2</Archive>
        <BuildDependencies>
            <Dependency>libtool</Dependency>
            <Dependency>doxygen</Dependency>
            <Dependency>pkgconfig</Dependency>
            <Dependency>libxml2</Dependency>
            <Dependency>freetype</Dependency>
            <Dependency>fontconfig</Dependency>
        </BuildDependencies>
    </Source>

    <Package>
        <Name>libbluray</Name>
        <RuntimeDependencies>
            <Dependency>libxml2</Dependency>
            <Dependency>freetype</Dependency>
            <Dependency>fontconfig</Dependency>
        </RuntimeDependencies>
        <Files>
            <Path fileType="executable">/usr/bin</Path>
            <Path fileType="library">/usr/lib</Path>
	    <Path fileType="data">/usr/share</Path>
	    <Path fileType="header">/usr/include</Path>
        </Files>
    </Package>


    <History>
        <Update release="1">
            <Date>2016-12-21</Date>
            <Version>0.9.2</Version>
            <Comment>First Release</Comment>
            <Name>Lime GNU/LINUX Community</Name>
            <Email>admin@limelinux.com</Email>
        </Update>
    </History>
</PISI>
