<?xml version="1.0" ?>
<!DOCTYPE PISI SYSTEM "http://www.limelinux.com/standard/pisi-spec.dtd">
<PISI>
    <Source>
        <Name>kdewebkit</Name>
        <Homepage>http://www.kde.org</Homepage>
        <Packager>
            <Name>Lime GNU/LINUX Community</Name>
            <Email>admin@limelinux.com</Email>
        </Packager>
        <License>LGPLv2</License>
        <IsA>library</IsA>
        <IsA>app:console</IsA>
        <Summary>KDE5 WebKit integration</Summary>
        <Description>KdeWebkit provides KDE integration of the QtWebKit library.</Description>
        <Archive sha1sum="76198e4433ad4d37f4a4c0dce830af227e025ee8" type="tarxz">mirrors://kde/stable/frameworks/5.38/kdewebkit-5.38.0.tar.xz</Archive>
        <BuildDependencies>
            <Dependency versionFrom="5.8">qt5</Dependency>
            <Dependency versionFrom="5.8">qt5-webkit</Dependency>
            <Dependency versionFrom="5.38.0">extra-cmake-modules</Dependency>
            <Dependency versionFrom="5.38.0">kconfig</Dependency>
            <Dependency versionFrom="5.38.0">kcoreaddons</Dependency>
            <Dependency versionFrom="5.38.0">kio</Dependency>
            <Dependency versionFrom="5.38.0">kjobwidgets</Dependency>
            <Dependency versionFrom="5.38.0">kparts</Dependency>
            <Dependency versionFrom="5.38.0">kservice</Dependency>
            <Dependency versionFrom="5.38.0">kwallet</Dependency>
        </BuildDependencies>
    </Source>

    <Package>
        <Name>kdewebkit</Name>
        <RuntimeDependencies>
            <Dependency versionFrom="5.8">qt5</Dependency>
            <Dependency versionFrom="5.8">qt5-webkit</Dependency>
            <Dependency>libgcc</Dependency>
            <Dependency versionFrom="5.38.0">kconfig</Dependency>
            <Dependency versionFrom="5.38.0">kjobwidgets</Dependency>            
            <Dependency versionFrom="5.38.0">kcoreaddons</Dependency>
            <Dependency versionFrom="5.38.0">kparts</Dependency>
            <Dependency versionFrom="5.38.0">kservice</Dependency>
            <Dependency versionFrom="5.38.0">kwallet</Dependency>
            <Dependency versionFrom="5.38.0">kio</Dependency>
        </RuntimeDependencies>
        <Files>
            <Path fileType="data">/usr/share</Path>
            <Path fileType="library">/usr/lib/qt5</Path>
            <Path fileType="library">/usr/lib</Path>
            <Path fileType="data">/usr/mkspecs/modules/</Path>
            <Path fileType="doc">/usr/share/doc</Path>
            <Path fileType="header">/usr/include</Path>
            <Path fileType="data">/usr/lib/cmake</Path>
            <Path fileType="config">/usr/lib/pkgconfig</Path>
        </Files>
    </Package>

    <History>
        <Update release="4">
            <Date>2017-09-12</Date>
            <Version>5.38.0</Version>
            <Comment>Version bump.</Comment>
            <Name>mahlas temir</Name>
            <Email>mahlastemir@gmail.com</Email>
        </Update>
    </History>
</PISI>
